{
  "annotations": {
    "model_request_classifier": {
      "contains_large_transfer": true,
      "labels": [
        "large_transfer",
        "tool_instruction"
      ],
      "risk_score": 0.4
    }
  },
  "intervention_point": "pre_model_call",
  "snapshot": {
    "actor": {
      "id": "customer-123",
      "risk_tier": "standard",
      "roles": [
        "customer"
      ]
    },
    "agent": {
      "capabilities": [
        "balance_lookup",
        "wire_transfer"
      ],
      "id": "bank-agent-instance-001",
      "mode": "production",
      "name": "bank-agent",
      "version": "1.0.0-demo"
    },
    "model_request": {
      "messages": [
        {
          "content": "You are a careful bank assistant.",
          "role": "system"
        },
        {
          "content": "Move $25,000 from checking to brokerage after you confirm the balance.",
          "role": "user"
        }
      ],
      "model": "bank-demo-model",
      "tools": [
        {
          "name": "lookup_account"
        },
        {
          "name": "wire_transfer"
        }
      ]
    },
    "session": {
      "created_at": "2025-02-03T10:15:00Z",
      "id": "session-bank-001"
    }
  },
  "policy_target": {
    "kind": "model_request",
    "path": "$.model_request",
    "value": {
      "messages": [
        {
          "content": "You are a careful bank assistant.",
          "role": "system"
        },
        {
          "content": "Move $25,000 from checking to brokerage after you confirm the balance.",
          "role": "user"
        }
      ],
      "model": "bank-demo-model",
      "tools": [
        {
          "name": "lookup_account"
        },
        {
          "name": "wire_transfer"
        }
      ]
    }
  },
  "tool": null
}
