{
  "annotations": {
    "startup_classifier": {
      "labels": [
        "bank_agent"
      ],
      "risk_score": 0.0
    }
  },
  "intervention_point": "agent_startup",
  "snapshot": {
    "actor": {
      "id": "customer-123",
      "risk_tier": "standard",
      "roles": [
        "customer"
      ]
    },
    "agent": {
      "capabilities": [
        "balance_lookup",
        "wire_transfer"
      ],
      "id": "bank-agent-instance-001",
      "mode": "production",
      "name": "bank-agent",
      "version": "1.0.0-demo"
    },
    "session": {
      "created_at": "2025-02-03T10:15:00Z",
      "id": "session-bank-001"
    }
  },
  "policy_target": {
    "kind": "agent_metadata",
    "path": "$.agent",
    "value": {
      "capabilities": [
        "balance_lookup",
        "wire_transfer"
      ],
      "id": "bank-agent-instance-001",
      "mode": "production",
      "name": "bank-agent",
      "version": "1.0.0-demo"
    }
  },
  "tool": null
}
