{
  "annotations": {
    "shutdown_classifier": {
      "labels": [
        "completed_with_blocked_action"
      ],
      "risk_score": 0.1
    }
  },
  "intervention_point": "agent_shutdown",
  "snapshot": {
    "actor": {
      "id": "customer-123",
      "risk_tier": "standard",
      "roles": [
        "customer"
      ]
    },
    "agent": {
      "capabilities": [
        "balance_lookup",
        "wire_transfer"
      ],
      "id": "bank-agent-instance-001",
      "mode": "production",
      "name": "bank-agent",
      "version": "1.0.0-demo"
    },
    "session": {
      "created_at": "2025-02-03T10:15:00Z",
      "ended_at": "2025-02-03T10:15:05Z",
      "id": "session-bank-001",
      "termination_reason": "completed"
    },
    "summary": {
      "blocked_actions": [
        "wire_transfer"
      ],
      "tool_calls_executed": [
        "lookup_account"
      ],
      "turns": 1,
      "user_visible_output": true
    }
  },
  "policy_target": {
    "kind": "shutdown_summary",
    "path": "$.summary",
    "value": {
      "blocked_actions": [
        "wire_transfer"
      ],
      "tool_calls_executed": [
        "lookup_account"
      ],
      "turns": 1,
      "user_visible_output": true
    }
  },
  "tool": null
}
