{
  "annotations": {
    "prompt_classifier": {
      "labels": [
        "finance_intent",
        "large_transfer"
      ],
      "risk_score": 0.42
    }
  },
  "intervention_point": "input",
  "snapshot": {
    "actor": {
      "id": "customer-123",
      "risk_tier": "standard",
      "roles": [
        "customer"
      ]
    },
    "agent": {
      "capabilities": [
        "balance_lookup",
        "wire_transfer"
      ],
      "id": "bank-agent-instance-001",
      "mode": "production",
      "name": "bank-agent",
      "version": "1.0.0-demo"
    },
    "input": {
      "text": "Move $25,000 from checking to brokerage after you confirm the balance."
    },
    "session": {
      "created_at": "2025-02-03T10:15:00Z",
      "id": "session-bank-001"
    },
    "transport": {
      "kind": "api_gateway",
      "route": "/chat"
    }
  },
  "policy_target": {
    "kind": "user_input",
    "path": "$.input",
    "value": {
      "text": "Move $25,000 from checking to brokerage after you confirm the balance."
    }
  },
  "tool": null
}
