{
  "annotations": {
    "output_classifier": {
      "contains_account_identifier": true,
      "labels": [
        "customer_profile",
        "account_identifier"
      ],
      "risk_score": 0.35
    }
  },
  "intervention_point": "output",
  "snapshot": {
    "actor": {
      "id": "customer-123",
      "risk_tier": "standard",
      "roles": [
        "customer"
      ]
    },
    "agent": {
      "capabilities": [
        "balance_lookup",
        "wire_transfer"
      ],
      "id": "bank-agent-instance-001",
      "mode": "production",
      "name": "bank-agent",
      "version": "1.0.0-demo"
    },
    "output": {
      "text": "I cannot execute the transfer yet. Account CHK-00112233 has an available balance of $18,342.15."
    },
    "session": {
      "created_at": "2025-02-03T10:15:00Z",
      "id": "session-bank-001"
    }
  },
  "policy_target": {
    "kind": "assistant_output",
    "path": "$.output",
    "value": {
      "text": "I cannot execute the transfer yet. Account CHK-00112233 has an available balance of $18,342.15."
    }
  },
  "tool": null
}
